{
  "moduleId": "typescript-14-modules-and-declarations",
  "title": "Module resolution and declaration files in one screen",
  "rememberThis": [
    "Module resolution: node, bundler, and nodenext",
    "paths, baseUrl, and import aliases",
    "Ambient declarations and declare global",
    "Typing JavaScript libraries (@types and hand-written .d.ts)",
    "declare module and module augmentation"
  ],
  "bullets": [
    "Module resolution: node, bundler, and nodenext: know definition + one example + one pitfall.",
    "paths, baseUrl, and import aliases: know definition + one example + one pitfall.",
    "Ambient declarations and declare global: know definition + one example + one pitfall.",
    "Typing JavaScript libraries (@types and hand-written .d.ts): know definition + one example + one pitfall.",
    "declare module and module augmentation: know definition + one example + one pitfall."
  ],
  "rows": [
    {
      "label": "Module stage",
      "value": "advanced"
    },
    {
      "label": "Topic count",
      "value": "5"
    },
    {
      "label": "Official hubs",
      "value": "TypeScript handbook, TypeScript release notes"
    }
  ]
}
