{
  "moduleId": "javascript-18-es-recap-performance",
  "title": "ES version recap, performance, and interview radar in one screen",
  "rememberThis": [
    "ES2015 through ES2024 feature map",
    "Performance idioms: memoization, lazy init, and batching",
    "Deep clone, deep equality, and circular references",
    "JavaScript code review radar for senior interviews",
    "Interview utilities: bind, once, memoize, and flatten"
  ],
  "bullets": [
    "ES2015 through ES2024 feature map: know definition + one example + one pitfall.",
    "Performance idioms: memoization, lazy init, and batching: know definition + one example + one pitfall.",
    "Deep clone, deep equality, and circular references: know definition + one example + one pitfall.",
    "JavaScript code review radar for senior interviews: know definition + one example + one pitfall.",
    "Interview utilities: bind, once, memoize, and flatten: know definition + one example + one pitfall."
  ],
  "rows": [
    {
      "label": "Module stage",
      "value": "advanced"
    },
    {
      "label": "Topic count",
      "value": "5"
    },
    {
      "label": "Official hubs",
      "value": "MDN JavaScript guide, javascript.info"
    }
  ]
}
