{
  "moduleId": "aws-18-saas-and-interview",
  "title": "SaaS on AWS in one screen",
  "rememberThis": [
    "Silo / pool / bridge — match isolation to pricing tier.",
    "Pooled default; VPC or DB per tenant for enterprise.",
    "Never trust client tenant_id — use signed JWT or verified subdomain.",
    "PostgreSQL RLS + middleware for row-level pool safety.",
    "Control plane provisions async; data plane serves users."
  ],
  "bullets": [
    "Cross-tenant data leak = top SaaS security failure.",
    "Per-tenant rate limits before scaling shared infra.",
    "DynamoDB: tenant_id in partition key.",
    "Step Functions for tenant onboarding workflow.",
    "SaaS Lens maps to Well-Architected six pillars."
  ],
  "rows": [
    {
      "label": "Tenancy",
      "value": "Silo / pool / bridge"
    },
    {
      "label": "Network",
      "value": "Pooled VPC vs per-tenant"
    },
    {
      "label": "Routing",
      "value": "Subdomain, JWT, blast radius"
    },
    {
      "label": "Data",
      "value": "Row + RLS, schema, dedicated DB"
    },
    {
      "label": "Fairness",
      "value": "Per-tenant limits and queues"
    },
    {
      "label": "Architecture",
      "value": "Control plane + data plane"
    }
  ]
}
