{
  "moduleId": "javascript-15-workers-and-concurrency",
  "title": "Web Workers, SharedArrayBuffer, and concurrency in one screen",
  "rememberThis": [
    "Web Workers and dedicated worker threads",
    "postMessage, structured clone, and transferables",
    "SharedArrayBuffer and Atomics",
    "Worker pools and offloading CPU work",
    "Workers versus C# threads and Task.Run"
  ],
  "bullets": [
    "Web Workers and dedicated worker threads: know definition + one example + one pitfall.",
    "postMessage, structured clone, and transferables: know definition + one example + one pitfall.",
    "SharedArrayBuffer and Atomics: know definition + one example + one pitfall.",
    "Worker pools and offloading CPU work: know definition + one example + one pitfall.",
    "Workers versus C# threads and Task.Run: know definition + one example + one pitfall."
  ],
  "rows": [
    {
      "label": "Module stage",
      "value": "advanced"
    },
    {
      "label": "Topic count",
      "value": "5"
    },
    {
      "label": "Official hubs",
      "value": "MDN JavaScript guide, javascript.info"
    }
  ]
}
