{
  "moduleId": "javascript-09-structural-typing-patterns",
  "title": "Structural typing and duck typing patterns in one screen",
  "rememberThis": [
    "Duck typing and shape-based APIs",
    "Runtime validation: typeof guards and schema libraries",
    "Branding with Symbol and opaque types in JS",
    "Nominal (C#) versus structural (JS/TS) typing",
    "Factory, builder, and object composition patterns"
  ],
  "bullets": [
    "Duck typing and shape-based APIs: know definition + one example + one pitfall.",
    "Runtime validation: typeof guards and schema libraries: know definition + one example + one pitfall.",
    "Branding with Symbol and opaque types in JS: know definition + one example + one pitfall.",
    "Nominal (C#) versus structural (JS/TS) typing: know definition + one example + one pitfall.",
    "Factory, builder, and object composition patterns: know definition + one example + one pitfall."
  ],
  "rows": [
    {
      "label": "Module stage",
      "value": "intermediate"
    },
    {
      "label": "Topic count",
      "value": "5"
    },
    {
      "label": "Official hubs",
      "value": "MDN JavaScript guide, javascript.info"
    }
  ]
}
