{
  "moduleId": "javascript-11-destructuring-spread-modern-syntax",
  "title": "Destructuring, spread, rest, and modern syntax in one screen",
  "rememberThis": [
    "Object destructuring, defaults, and renaming",
    "Array destructuring and swap patterns",
    "Spread and rest in arrays, objects, and function calls",
    "Shorthand properties and computed property names",
    "Readable patterns: options objects and named parameters"
  ],
  "bullets": [
    "Object destructuring, defaults, and renaming: know definition + one example + one pitfall.",
    "Array destructuring and swap patterns: know definition + one example + one pitfall.",
    "Spread and rest in arrays, objects, and function calls: know definition + one example + one pitfall.",
    "Shorthand properties and computed property names: know definition + one example + one pitfall.",
    "Readable patterns: options objects and named parameters: know definition + one example + one pitfall."
  ],
  "rows": [
    {
      "label": "Module stage",
      "value": "intermediate"
    },
    {
      "label": "Topic count",
      "value": "5"
    },
    {
      "label": "Official hubs",
      "value": "MDN JavaScript guide, javascript.info"
    }
  ]
}
