{
  "moduleId": "aws-09-ec2-compute",
  "title": "ec2-compute in one screen",
  "rememberThis": [
    "AMI + instance type + subnet + security group = launch decision set.",
    "Primary ENI determines subnet, private IP, and route table association.",
    "ASG spreads instances across AZs; use target tracking for most web workloads.",
    "EBS survives stop/start; instance store does not — pick per workload.",
    "Troubleshoot networking outside-in: route → NACL → SG → OS."
  ],
  "bullets": [
    "Use launch templates (not launch configurations) for versioned, reusable launches.",
    "IMDSv2 required token stops SSRF credential theft from compromised apps.",
    "Placement groups: cluster for HPC, spread for critical singletons, partition for large distributed systems.",
    "Disable source/dest check only for NAT instances or firewalls — not app servers.",
    "Instance store offers higher IOPS at the cost of durability."
  ],
  "rows": [
    {
      "label": "AMI",
      "value": "Bootable image snapshot — OS, apps, and EBS mappings"
    },
    {
      "label": "ENI",
      "value": "Virtual NIC in a subnet — carries private (and optional public) IP"
    },
    {
      "label": "ASG",
      "value": "Maintains fleet size with policies and health checks"
    },
    {
      "label": "EBS",
      "value": "Network-attached block storage — persists independently"
    },
    {
      "label": "Instance store",
      "value": "Physically attached disks — high perf, ephemeral"
    }
  ]
}
