{
  "moduleId": "javascript-12-functional-array-methods",
  "title": "Functional programming and array methods in one screen",
  "rememberThis": [
    "map, filter, reduce, and chaining",
    "flat, flatMap, and groupBy patterns",
    "Currying, partial application, and compose",
    "Implementing map, filter, and flatten from scratch",
    "JavaScript array methods versus C# LINQ"
  ],
  "bullets": [
    "map, filter, reduce, and chaining: know definition + one example + one pitfall.",
    "flat, flatMap, and groupBy patterns: know definition + one example + one pitfall.",
    "Currying, partial application, and compose: know definition + one example + one pitfall.",
    "Implementing map, filter, and flatten from scratch: know definition + one example + one pitfall.",
    "JavaScript array methods versus C# LINQ: know definition + one example + one pitfall."
  ],
  "rows": [
    {
      "label": "Module stage",
      "value": "intermediate"
    },
    {
      "label": "Topic count",
      "value": "5"
    },
    {
      "label": "Official hubs",
      "value": "MDN JavaScript guide, javascript.info"
    }
  ]
}
