{
  "moduleId": "typescript-10-utility-types",
  "title": "Built-in utility types and type transformations in one screen",
  "rememberThis": [
    "Partial, Required, Pick, and Omit",
    "Record, Exclude, Extract, and NonNullable",
    "Parameters, ReturnType, ConstructorParameters",
    "Composing utility types for DTOs and API layers",
    "Utility types versus C# generics constraints"
  ],
  "bullets": [
    "Partial, Required, Pick, and Omit: know definition + one example + one pitfall.",
    "Record, Exclude, Extract, and NonNullable: know definition + one example + one pitfall.",
    "Parameters, ReturnType, ConstructorParameters: know definition + one example + one pitfall.",
    "Composing utility types for DTOs and API layers: know definition + one example + one pitfall.",
    "Utility types versus C# generics constraints: know definition + one example + one pitfall."
  ],
  "rows": [
    {
      "label": "Module stage",
      "value": "intermediate"
    },
    {
      "label": "Topic count",
      "value": "5"
    },
    {
      "label": "Official hubs",
      "value": "TypeScript handbook, TypeScript release notes"
    }
  ]
}
